{
  "$schema": "https://json-schema.org/draft/2020-12/schema",
  "$id": "https://tchyze.github.io/vigie-collector/schema/product.schema.json",
  "title": "Vigie : fichier produit",
  "description": "Toutes les branches de version d'un produit (output/products/<produit>.json).",
  "type": "object",
  "additionalProperties": false,
  "required": ["schema_version", "generated_at", "product", "label", "vendor", "category", "branches"],
  "properties": {
    "schema_version": {"const": 1},
    "generated_at": {"$ref": "#/$defs/datetime"},
    "product": {"$ref": "#/$defs/slug"},
    "label": {"type": "string", "minLength": 1},
    "vendor": {"type": "string", "minLength": 1},
    "category": {"$ref": "#/$defs/category"},
    "branches": {"type": "array", "items": {"$ref": "#/$defs/branch"}}
  },
  "$defs": {
    "slug": {"type": "string", "pattern": "^[a-z0-9]+(?:[.-][a-z0-9]+)*$"},
    "date": {"type": "string", "pattern": "^\\d{4}-\\d{2}-\\d{2}$"},
    "nullableDate": {"oneOf": [{"$ref": "#/$defs/date"}, {"type": "null"}]},
    "datetime": {"type": "string", "pattern": "^\\d{4}-\\d{2}-\\d{2}T\\d{2}:\\d{2}:\\d{2}Z$"},
    "nullableUrl": {"oneOf": [{"type": "string", "pattern": "^https?://"}, {"type": "null"}]},
    "category": {"enum": ["firewall", "switch", "os", "service"]},
    "eolKey": {"enum": ["end_of_active_support", "end_of_security_support", "end_of_life", "end_of_extended_support"]},
    "branch": {
      "type": "object",
      "additionalProperties": false,
      "required": [
        "id", "product", "vendor", "category", "branch", "label", "lts", "release_date", "status",
        "latest_version", "latest_release_date", "eol", "releases", "sources"
      ],
      "properties": {
        "id": {"$ref": "#/$defs/slug"},
        "product": {"$ref": "#/$defs/slug"},
        "vendor": {"type": "string", "minLength": 1},
        "category": {"$ref": "#/$defs/category"},
        "branch": {"type": "string", "minLength": 1},
        "label": {"type": "string", "minLength": 1},
        "lts": {"type": ["boolean", "null"]},
        "release_date": {"$ref": "#/$defs/nullableDate"},
        "status": {"enum": ["active", "eol_soon", "eol"]},
        "latest_version": {"type": ["string", "null"]},
        "latest_release_date": {"$ref": "#/$defs/nullableDate"},
        "eol": {"$ref": "#/$defs/eol"},
        "releases": {"type": "array", "items": {"$ref": "#/$defs/release"}},
        "sources": {"type": "array", "items": {"type": "string"}, "uniqueItems": true}
      }
    },
    "eol": {
      "type": "object",
      "additionalProperties": false,
      "required": [
        "end_of_active_support", "end_of_security_support", "end_of_life", "end_of_extended_support",
        "trigger", "trigger_date", "declared_eol", "labels", "source_url"
      ],
      "properties": {
        "end_of_active_support": {"$ref": "#/$defs/nullableDate"},
        "end_of_security_support": {"$ref": "#/$defs/nullableDate"},
        "end_of_life": {"$ref": "#/$defs/nullableDate"},
        "end_of_extended_support": {"$ref": "#/$defs/nullableDate"},
        "trigger": {"$ref": "#/$defs/eolKey"},
        "trigger_date": {"$ref": "#/$defs/nullableDate"},
        "declared_eol": {"type": "boolean"},
        "labels": {
          "type": "object",
          "propertyNames": {"$ref": "#/$defs/eolKey"},
          "additionalProperties": {"type": "string"}
        },
        "source_url": {"$ref": "#/$defs/nullableUrl"}
      }
    },
    "release": {
      "type": "object",
      "additionalProperties": false,
      "required": ["version", "date", "security_fix", "summary", "url"],
      "properties": {
        "version": {"type": "string", "minLength": 1},
        "date": {"$ref": "#/$defs/nullableDate"},
        "security_fix": {"type": ["boolean", "null"]},
        "summary": {"type": ["string", "null"], "maxLength": 300},
        "url": {"$ref": "#/$defs/nullableUrl"}
      }
    }
  }
}
