{
  "schema_version": 1,
  "generated_at": "2026-10-31T12:40:35Z",
  "product": "openssh",
  "label": "OpenSSH",
  "vendor": "OpenBSD",
  "category": "service",
  "branches": [
    {
      "id": "openssh-portable",
      "product": "openssh",
      "vendor": "OpenBSD",
      "category": "service",
      "branch": "portable",
      "label": "portable",
      "lts": null,
      "release_date": null,
      "status": "active",
      "latest_version": "10.6p1",
      "latest_release_date": "2026-10-06",
      "eol": {
        "end_of_active_support": null,
        "end_of_security_support": null,
        "end_of_life": null,
        "end_of_extended_support": null,
        "trigger": "end_of_life",
        "trigger_date": null,
        "declared_eol": false,
        "labels": {},
        "source_url": null
      },
      "releases": [
        {
          "version": "10.6p1",
          "date": "2026-10-06",
          "security_fix": null,
          "summary": null,
          "url": "https://www.openssh.org/txt/release-10.6"
        },
        {
          "version": "10.5p1",
          "date": "2026-08-11",
          "security_fix": null,
          "summary": null,
          "url": "https://www.openssh.org/txt/release-10.5"
        },
        {
          "version": "10.4p1",
          "date": "2026-07-06",
          "security_fix": null,
          "summary": null,
          "url": "https://www.openssh.org/txt/release-10.4"
        },
        {
          "version": "10.3p1",
          "date": "2026-04-02",
          "security_fix": null,
          "summary": null,
          "url": "https://www.openssh.org/txt/release-10.3"
        },
        {
          "version": "10.2p1",
          "date": "2025-10-10",
          "security_fix": null,
          "summary": null,
          "url": "https://www.openssh.org/txt/release-10.2"
        },
        {
          "version": "10.1p1",
          "date": "2025-10-06",
          "security_fix": null,
          "summary": null,
          "url": "https://www.openssh.org/txt/release-10.1"
        },
        {
          "version": "10.0p2",
          "date": "2025-04-09",
          "security_fix": null,
          "summary": null,
          "url": "https://www.openssh.org/txt/release-10.0"
        },
        {
          "version": "10.0p1",
          "date": "2025-04-09",
          "security_fix": null,
          "summary": null,
          "url": "https://www.openssh.org/txt/release-10.0"
        },
        {
          "version": "9.9p2",
          "date": "2025-02-18",
          "security_fix": null,
          "summary": null,
          "url": "https://www.openssh.org/txt/release-9.9"
        },
        {
          "version": "9.9p1",
          "date": "2024-09-19",
          "security_fix": null,
          "summary": null,
          "url": "https://www.openssh.org/txt/release-9.9"
        }
      ],
      "sources": [
        "openssh"
      ]
    }
  ]
}
